{
  "$schema": "https://json-schema.org/draft/2020-12/schema",
  "$id": "https://scrollcase.dev/schema/v2/scroll.schema.json",
  "title": "Box scroll",
  "description": "The declarative input to a build: an identity, a target, a pinned dependency environment, the assets to fetch, and the self-test the result must pass. A scroll is checked into the consumer's repository next to its lock file; everything a build produces is derived from it.\n\nOnly what a build cannot work out for itself is required. Anything the target or the identity already determines is optional here and filled in when the scroll is read, so a hand-written scroll declares decisions rather than restating them.\n\nOne box's targets differ in a handful of lines and agree on the rest, so a scroll may also be split: scrolls/<boxId>/scroll.json holds what they share, and each scrolls/<boxId>/<targetId>/scroll.json declares `extends` plus its own differences. Both halves are files of this shape; the joined result is what a build reads.",
  "type": "object",
  "additionalProperties": false,
  "required": [
    "schemaVersion",
    "boxId",
    "modelId",
    "runtimeId",
    "version",
    "sourceRevision",
    "pythonVersion",
    "selfTest",
    "pixiVersion"
  ],
  "properties": {
    "$schema": {
      "const": "https://scrollcase.dev/schema/v2/scroll.schema.json",
      "description": "Associates this file with the published Scrollcase v2 schema for editor validation, completion, and hover help."
    },
    "extends": {
      "const": "../scroll.json",
      "description": "Marks this file as one target's fragment of a box whose shared declarations live in scrolls/<boxId>/scroll.json. The value is fixed: a base is always the box directory's own scroll.json, so there is no path to get wrong and no chain to follow. The base and the fragment are joined into one effective scroll before anything else happens, and that effective scroll is what the build reads and what provenance records."
    },
    "schemaVersion": {
      "const": 2,
      "description": "Scrollcase wire version. Version 2 is the only active format.",
      "examples": [
        2
      ]
    },
    "scrollId": {
      "type": "string",
      "minLength": 1,
      "description": "Optional provenance identity. When omitted, Scrollcase derives it deterministically from boxId and the canonical target."
    },
    "scrollVersion": {
      "type": "string",
      "minLength": 1,
      "description": "Version of this declarative build input, recorded in provenance. Defaults to 1.0.0, which is what an authoring version means before anyone has had reason to change it.",
      "default": "1.0.0",
      "examples": [
        "1.0.0"
      ]
    },
    "boxId": {
      "$ref": "#/$defs/identifier"
    },
    "modelId": {
      "$ref": "#/$defs/identifier"
    },
    "runtimeId": {
      "$ref": "#/$defs/identifier"
    },
    "version": {
      "type": "string",
      "minLength": 1,
      "description": "Version of the box this scroll produces, as it will appear in the release manifest."
    },
    "sourceRevision": {
      "type": "string",
      "minLength": 1,
      "description": "Upstream revision of the packaged source, recorded verbatim into provenance."
    },
    "target": {
      "$ref": "https://scrollcase.dev/schema/v2/target.schema.json",
      "description": "The (platform, arch, accelerator) triple this box is built for. Required in every scroll a build reads, and absent from a base: a base holds what its targets share, so declaring one there would name a target the box does not build. Enforced when the scroll is read rather than here, so a base file still validates in an editor."
    },
    "compatibility": {
      "type": "object",
      "additionalProperties": true,
      "properties": {
        "minHostAppVersion": {
          "type": "string",
          "minLength": 1,
          "description": "Lowest version of the installing application this box supports."
        },
        "maxHostAppVersionExclusive": {
          "type": "string",
          "minLength": 1
        },
        "minMacosVersion": {
          "type": "string",
          "minLength": 1
        },
        "minRamGb": {
          "type": "number",
          "exclusiveMinimum": 0
        },
        "minNvidiaDriverVersion": {
          "type": "string",
          "minLength": 1
        }
      },
      "description": "Constraints the installing host must satisfy. Copied through into the release manifest verbatim and never interpreted by the builder, so a project may declare its own alongside these. Defaults to empty: declaring no constraint is a legitimate answer, and inventing one would be a claim the project never made."
    },
    "pythonVersion": {
      "type": "string",
      "minLength": 1,
      "description": "Python version solved into the box.",
      "examples": [
        "3.11.15"
      ]
    },
    "pixiVersion": {
      "type": "string",
      "minLength": 1,
      "description": "Pins the pixi release used to solve and install the conda-forge environment from the committed pixi.lock."
    },
    "condaDependencyLicenseAudit": {
      "type": "string",
      "minLength": 1,
      "description": "Path to the reviewed licence inventory derived from pixi.lock, which carries an SPDX licence per package. The build fails if the lock no longer matches what was reviewed."
    },
    "pythonEntryPoint": {
      "type": "string",
      "minLength": 1,
      "description": "Interpreter path relative to the box root. The target adapter's layout admits exactly one value, so this is derived from the target when omitted and still checked against it when declared."
    },
    "modelCacheSubdir": {
      "type": "string",
      "minLength": 1,
      "description": "Payload directory the box's model files live under. Defaults to model-cache/<boxId>."
    },
    "environment": {
      "type": "object",
      "description": "Environment variables the box requires when its interpreter runs. The declaration is copied into box.json and the signed release; its values override both the inherited host environment and caller-supplied values.",
      "propertyNames": {
        "minLength": 1,
        "pattern": "^[^=\\u0000]+$"
      },
      "additionalProperties": {
        "type": "string",
        "pattern": "^[^\\u0000]*$"
      }
    },
    "assetBaseUrl": {
      "type": "string",
      "minLength": 1,
      "description": "Base URL of the mirror the built archive and its objects are published under."
    },
    "assets": {
      "type": "array",
      "description": "Files fetched during the build. Every entry is size- and hash-checked before use, so a moved or replaced upstream file fails the build instead of silently changing the box. May be empty, and defaults to empty.",
      "items": {
        "type": "object",
        "additionalProperties": false,
        "required": [
          "url",
          "relativePath",
          "sizeBytes",
          "sha256"
        ],
        "properties": {
          "url": {
            "type": "string",
            "minLength": 1
          },
          "relativePath": {
            "$ref": "#/$defs/payloadPath"
          },
          "sizeBytes": {
            "type": "integer",
            "exclusiveMinimum": 0
          },
          "sha256": {
            "$ref": "#/$defs/sha256"
          }
        }
      }
    },
    "assetArchives": {
      "type": "array",
      "description": "Downloaded archives to expand into the payload. Extraction preserves files already present in the destination and refuses to overwrite them.",
      "items": {
        "type": "object",
        "additionalProperties": false,
        "required": [
          "relativePath",
          "format",
          "destination"
        ],
        "properties": {
          "relativePath": {
            "$ref": "#/$defs/payloadPath"
          },
          "format": {
            "enum": [
              "zip",
              "tar.gz"
            ]
          },
          "destination": {
            "$ref": "#/$defs/payloadPath"
          },
          "stripComponents": {
            "type": "integer",
            "minimum": 0
          },
          "removeAfterExtract": {
            "type": "boolean"
          }
        }
      }
    },
    "localFiles": {
      "type": "array",
      "description": "Files copied from the consumer's own repository into the payload. A file already under the project's own version control needs no second copy of its identity here, and what ships is hashed into the signed release either way; declaring sha256 pins one that must not change without review, which suits a licence notice and not a script still being written.",
      "items": {
        "type": "object",
        "additionalProperties": false,
        "required": [
          "sourcePath",
          "relativePath"
        ],
        "properties": {
          "sourcePath": {
            "type": "string",
            "minLength": 1
          },
          "relativePath": {
            "$ref": "#/$defs/payloadPath"
          },
          "sha256": {
            "$ref": "#/$defs/sha256",
            "description": "Optional pin. When present the build refuses a file whose contents no longer match."
          }
        }
      }
    },
    "prunePaths": {
      "type": "array",
      "description": "Payload paths deleted before packing, to keep the box to what it actually needs at run time. Pruning a distribution the lock requires is rejected.",
      "items": {
        "$ref": "#/$defs/payloadPath"
      }
    },
    "uncompressedPaths": {
      "type": "array",
      "description": "Payload paths stored in the archive instead of deflated, because their bytes are already compressed and re-compressing them costs build time while making the archive marginally larger. A path matches itself and everything beneath it, so one entry can name a weights file or the directory an expanded asset archive landed in. Declared assets are stored automatically; this is for anything else the project knows to be already compressed.",
      "items": {
        "$ref": "#/$defs/payloadPath"
      }
    },
    "selfTest": {
      "type": "object",
      "additionalProperties": false,
      "required": [
        "imports"
      ],
      "not": {
        "required": [
          "pythonCode",
          "pythonFile"
        ]
      },
      "description": "Builder checks run with the payload's own interpreter before archiving. Schema version 2 signs only the import subset for a consumer to repeat; file and optional Python-code assertions remain builder-only.",
      "properties": {
        "imports": {
          "type": "array",
          "minItems": 1,
          "items": {
            "type": "string",
            "minLength": 1
          }
        },
        "files": {
          "type": "array",
          "description": "Files that must still exist after pruning, which is what stops an over-aggressive prune from shipping a broken box. Defaults to empty.",
          "items": {
            "$ref": "#/$defs/payloadPath"
          }
        },
        "pythonCode": {
          "type": "string",
          "minLength": 1,
          "description": "Extra Python executed after the imports succeed, for checks a bare import cannot make. Anything longer than an assertion belongs in pythonFile, where an editor can see it is Python."
        },
        "pythonFile": {
          "type": "string",
          "minLength": 1,
          "description": "Project path to a Python file executed after the imports succeed, in place of pythonCode. The file is read at build time and run from the payload root, so a real self-test keeps its syntax highlighting, its linter, and its diffs instead of living inside a JSON string."
        }
      }
    },
    "weights": {
      "enum": [
        "embed",
        "on-demand"
      ],
      "default": "embed",
      "description": "Whether assets are packed into the archive (embed, the default: the box installs with no network and works air-gapped) or left out for the caller to materialize from descriptors in the signed release (on-demand). Consumers verify materialized assets before execution and do not download them. A build may override this."
    },
    "execution": {
      "$ref": "https://scrollcase.dev/schema/v2/execution.schema.json"
    },
    "parity": {
      "type": "object",
      "additionalProperties": false,
      "required": [
        "script",
        "accelerators",
        "tolerances"
      ],
      "description": "An optional numerical gate: run a check inside the box on more than one accelerator and require the results to agree. This catches a mis-solved environment \u2014 CPU-only wheels shipped as CUDA, a broken BLAS \u2014 on the build machine rather than on a user's. The tool runs the check and enforces the thresholds; what the check computes, and what closeness is acceptable, belong to the project.",
      "properties": {
        "script": {
          "type": "string",
          "minLength": 1,
          "description": "Path inside the box, run with the box's own interpreter. It must print a JSON array of numbers, or an object with a \"values\" array."
        },
        "accelerators": {
          "type": "array",
          "minItems": 2,
          "items": {
            "enum": [
              "cpu",
              "metal",
              "cuda"
            ]
          },
          "description": "Accelerators to run under, each with its target's validation environment. The first is the reference the others are compared against \u2014 conventionally cpu, being the one available everywhere."
        },
        "tolerances": {
          "type": "object",
          "additionalProperties": false,
          "minProperties": 1,
          "description": "At least one bound. Absolute guards entries near zero, where relative error is meaningless; cosine similarity catches a result that drifted in direction rather than magnitude.",
          "properties": {
            "absolute": {
              "type": "number",
              "exclusiveMinimum": 0
            },
            "relative": {
              "type": "number",
              "exclusiveMinimum": 0
            },
            "minimumCosine": {
              "type": "number",
              "maximum": 1
            }
          }
        }
      }
    }
  },
  "$defs": {
    "identifier": {
      "type": "string",
      "pattern": "^[a-z0-9]+(?:[-.][a-z0-9]+)*$"
    },
    "sha256": {
      "type": "string",
      "pattern": "^[a-f0-9]{64}$"
    },
    "payloadPath": {
      "type": "string",
      "minLength": 1,
      "pattern": "^(?!/)(?![A-Za-z]:)(?!.*\\\\)(?!.*(?:^|/)\\.\\.(?:/|$))(?!.*//).+$",
      "description": "A forward-slash path inside the box payload: relative, non-empty, and unable to escape the payload root.",
      "examples": [
        "model-cache/example-model/weights.safetensors"
      ]
    }
  }
}
